{
  "schemaVersion": "1.0.0",
  "bootstrapVersion": "c84bd2790acf30ab",
  "generatedAt": "2026-02-04T15:09:26Z",
  "tagMasterVersion": "ef4b2ffd32d5b54a",
  "archiveVersion": "fcb1ccf00503b44f",
  "tagTypes": [
    {
      "id": 0,
      "key": "channel",
      "name": "チャンネル",
      "order": 0,
      "singleSelect": true,
      "requiredPerVideo": true
    },
    {
      "id": 1,
      "key": "majorCategory",
      "name": "大分類",
      "order": 1,
      "singleSelect": true,
      "requiredPerVideo": true
    },
    {
      "id": 2,
      "key": "performer",
      "name": "出演者名",
      "order": 2,
      "singleSelect": false,
      "requiredPerVideo": false
    },
    {
      "id": 3,
      "key": "unit",
      "name": "ユニット名",
      "order": 3,
      "singleSelect": false,
      "requiredPerVideo": false
    },
    {
      "id": 4,
      "key": "gameTitle",
      "name": "ゲーム名",
      "order": 4,
      "singleSelect": false,
      "requiredPerVideo": false
    },
    {
      "id": 5,
      "key": "gameGenre",
      "name": "ゲームジャンル",
      "order": 5,
      "singleSelect": false,
      "requiredPerVideo": false
    },
    {
      "id": 6,
      "key": "series",
      "name": "シリーズ名",
      "order": 6,
      "singleSelect": false,
      "requiredPerVideo": false
    },
    {
      "id": 7,
      "key": "contentTitle",
      "name": "コンテンツ名",
      "order": 7,
      "singleSelect": false,
      "requiredPerVideo": false
    },
    {
      "id": 8,
      "key": "contentGenre",
      "name": "コンテンツジャンル",
      "order": 8,
      "singleSelect": false,
      "requiredPerVideo": false
    },
    {
      "id": 9,
      "key": "projectTitle",
      "name": "企画名",
      "order": 9,
      "singleSelect": false,
      "requiredPerVideo": false
    },
    {
      "id": 10,
      "key": "projectMajor",
      "name": "企画大分類",
      "order": 10,
      "singleSelect": true,
      "requiredPerVideo": false
    },
    {
      "id": 11,
      "key": "projectGenre",
      "name": "企画ジャンル",
      "order": 11,
      "singleSelect": false,
      "requiredPerVideo": false
    },
    {
      "id": 12,
      "key": "streamGenre",
      "name": "配信ジャンル",
      "order": 12,
      "singleSelect": false,
      "requiredPerVideo": false
    },
    {
      "id": 13,
      "key": "format",
      "name": "動画形式",
      "order": 13,
      "singleSelect": true,
      "requiredPerVideo": true
    }
  ],
  "tagPreview": [
    [
      6,
      0,
      "えま★おうがすと / Emma★August【にじさんじ】"
    ],
    [
      54,
      0,
      "白雪 巴/Shirayuki Tomoe"
    ],
    [
      75,
      1,
      "TRPG"
    ],
    [
      76,
      1,
      "ゲーム"
    ],
    [
      77,
      1,
      "企画"
    ],
    [
      78,
      1,
      "同時視聴"
    ],
    [
      79,
      1,
      "歌"
    ],
    [
      81,
      1,
      "踊ってみた"
    ],
    [
      82,
      1,
      "雑談"
    ],
    [
      85,
      2,
      "えま★おうがすと"
    ],
    [
      91,
      2,
      "オリバー・エバンス"
    ],
    [
      98,
      2,
      "フミ"
    ],
    [
      106,
      2,
      "七瀬すず菜"
    ],
    [
      137,
      2,
      "来栖夏芽"
    ],
    [
      154,
      2,
      "竜胆尊"
    ],
    [
      157,
      2,
      "綺沙良"
    ],
    [
      158,
      2,
      "緑仙"
    ],
    [
      161,
      2,
      "蝸堂みかる"
    ],
    [
      184,
      3,
      "セクスィー色に染まらなイカ？"
    ],
    [
      189,
      3,
      "八月の雪"
    ],
    [
      191,
      3,
      "女王と会長"
    ],
    [
      216,
      4,
      "Detroit: Become Human"
    ],
    [
      252,
      4,
      "SILENT HILL f"
    ],
    [
      322,
      4,
      "スプラトゥーン3"
    ],
    [
      390,
      4,
      "崩壊：スターレイル"
    ],
    [
      426,
      4,
      "都市伝説解体センター"
    ],
    [
      429,
      4,
      "雀魂 -じゃんたま-"
    ],
    [
      431,
      4,
      "魔法使いの愛した子"
    ],
    [
      434,
      5,
      "FPS/TPS"
    ],
    [
      435,
      5,
      "RPG"
    ],
    [
      436,
      5,
      "アクション"
    ],
    [
      437,
      5,
      "アドベンチャー"
    ],
    [
      441,
      5,
      "テーブルゲーム"
    ],
    [
      444,
      5,
      "ビジュアルノベル"
    ],
    [
      445,
      5,
      "ホラー"
    ],
    [
      447,
      6,
      "スプラトゥーン"
    ],
    [
      457,
      7,
      "ホーム・アローン"
    ],
    [
      458,
      7,
      "ホーム・アローン2"
    ],
    [
      459,
      7,
      "大会"
    ],
    [
      464,
      8,
      "ライブ"
    ],
    [
      465,
      8,
      "映画"
    ],
    [
      515,
      10,
      "バラエティー"
    ],
    [
      526,
      12,
      "#にじイカ祭り2025"
    ],
    [
      535,
      12,
      "3D"
    ],
    [
      538,
      12,
      "SILENT HILL"
    ],
    [
      540,
      12,
      "※ネタバレあり"
    ],
    [
      543,
      12,
      "いっ杯晩酌"
    ],
    [
      549,
      12,
      "その他"
    ],
    [
      550,
      12,
      "その他企画"
    ],
    [
      559,
      12,
      "コラボ"
    ],
    [
      564,
      12,
      "公式切り抜き"
    ],
    [
      568,
      12,
      "振り返り"
    ],
    [
      571,
      12,
      "晩酌"
    ],
    [
      578,
      12,
      "生誕祭"
    ],
    [
      581,
      12,
      "耐久"
    ],
    [
      586,
      12,
      "誕生祭"
    ],
    [
      588,
      13,
      "動画"
    ],
    [
      589,
      13,
      "配信"
    ],
    [
      590,
      4,
      "Mouthwashing"
    ],
    [
      591,
      4,
      "ダレカレ"
    ]
  ],
  "latest": [
    [
      "GoWhHtJmIbk",
      "【#白雪巴誕生日2026】ケーキを食べてパーッとお祝いしちゃおうかしら🎉🎉🎉【白雪巴/にじさんじ】",
      54,
      1770213725,
      0,
      [
        77,
        578,
        464,
        586,
        589,
        54
      ]
    ],
    [
      "7keH8yrqabc",
      "【Detroit: Become Human】クリア耐久。5年ぶりにプレイしたら結末は変わるのか…？【白雪巴/にじさんじ】",
      54,
      1770213272,
      0,
      [
        76,
        216,
        437,
        581,
        589,
        54
      ]
    ],
    [
      "c9TnpjK3ZZE",
      "＃55【崩壊：スターレイル】オンパロス編。Ver3.6突入！長夜月の正体迫る…！？【白雪 巴/にじさんじ】",
      54,
      1770209774,
      13120,
      [
        76,
        390,
        435,
        589,
        54
      ]
    ],
    [
      "aQg0muFZFXI",
      "TRPG「カタシロ」を終えて振り返ってみる。※ネタバレあり※【白雪 巴/にじさんじ】",
      54,
      1769875748,
      7228,
      [
        82,
        568,
        540,
        589,
        54
      ]
    ],
    [
      "wcGQvZCoZCw",
      "【都市伝説解体センター #5】第四話「漏れ広がる邪悪」初見プレイ！※ネタバレ注意【白雪巴/にじさんじ】",
      54,
      1769504897,
      13952,
      [
        76,
        426,
        445,
        589,
        54
      ]
    ],
    [
      "vmhPld8Bd2Y",
      "【ダレカレ】最後には号泣するゲームだってオススメ(？)されました。【白雪巴/にじさんじ】",
      54,
      1769271363,
      11198,
      [
        76,
        591,
        444,
        589,
        54
      ]
    ],
    [
      "xlFWAjtC6No",
      "＃54【崩壊：スターレイル】オンパロス編。自分、いつでもラスボスいけます。【白雪 巴/にじさんじ】",
      54,
      1768927001,
      12197,
      [
        76,
        390,
        435,
        589,
        54
      ]
    ],
    [
      "zPoP351L6IM",
      "【Mouthwashing】サンタさんからプレゼントされたゲームで遊ぶ✨【白雪巴/にじさんじ】",
      54,
      1768756456,
      14485,
      [
        76,
        590,
        445,
        589,
        54
      ]
    ],
    [
      "3ndskwVyZ8o",
      "＃53【崩壊：スターレイル】オンパロス編。未来を「開拓」しにいく……！【白雪 巴/にじさんじ】",
      54,
      1768577403,
      8429,
      [
        76,
        390,
        435,
        589,
        54
      ]
    ],
    [
      "wnwGejKxpWw",
      "【都市伝説解体センター #4】第三話「辺獄への階段」初見プレイ！※ネタバレ注意【白雪巴/にじさんじ】",
      54,
      1768303849,
      17041,
      [
        76,
        426,
        445,
        589,
        54
      ]
    ],
    [
      "JGJcZVE3v0A",
      "【#にじさんじ麻雀杯2026】H卓🌸今年こそは予選突破したい…！【白雪巴/にじさんじ】",
      54,
      1768037982,
      3720,
      [
        76,
        429,
        441,
        459,
        589,
        54
      ]
    ],
    [
      "zih96cqW4RU",
      "【ストプレ】『魔法使いの愛した子』を体験するぞ。※ネタバレ注意【来栖夏芽/白雪巴/にじさんじ】",
      54,
      1767885531,
      10424,
      [
        75,
        559,
        137,
        191,
        431,
        436,
        589,
        54
      ]
    ],
    [
      "RPK0UVHEYVY",
      "🌸新年初ソロ配信🌸コラボ振り返りと今年の抱負など雑談【白雪 巴/にじさんじ】",
      54,
      1767534162,
      8491,
      [
        82,
        568,
        589,
        54
      ]
    ],
    [
      "z1H2obyg43g",
      "【#和風歌50曲耐久3Dコラボ】新春🌸飲み食いしながらカラオケ和風ソング縛りカラオケ🎤✨✨【緑仙/竜胆尊/フミ/綺沙良/白雪巴/にじさんじ】",
      54,
      1767356292,
      17759,
      [
        79,
        559,
        98,
        154,
        157,
        158,
        535,
        581,
        589,
        54
      ]
    ],
    [
      "D9F3jYzhEws",
      "#ラブライブ 輝夜の城で踊りたい/μ's 踊ってみた👠🌟 #shorts #白雪巴 #にじさんじ",
      54,
      1767193234,
      22,
      [
        81,
        550,
        515,
        549,
        564,
        588,
        54
      ]
    ],
    [
      "olrw2NT3bwE",
      "【2025年納め】今年を振り返りながら来年の干支を描いてプレゼント🎁告知あり✨【白雪 巴/にじさんじ】",
      54,
      1767173725,
      11368,
      [
        77,
        550,
        515,
        549,
        589,
        54
      ]
    ],
    [
      "JImkIAWewR8",
      "＃52.5【崩壊：スターレイル】ダリアをガチャでお迎えしたらド好みすぎてデート回になりました。【白雪 巴/にじさんじ】",
      54,
      1767082758,
      7726,
      [
        76,
        390,
        435,
        589,
        54
      ]
    ],
    [
      "F4kGOM3g3To",
      "IRIS OUT/米津玄師 お姉さんVtuberが踊るとこうなる #shorts #白雪巴 #にじさんじ",
      54,
      1766667624,
      16,
      [
        81,
        564,
        588,
        54
      ]
    ],
    [
      "AX39sFEZSRg",
      "【お家デートしよ💓】クリスマス🎄に映画「ホーム・アローン1・2」を初見で観る夜💕【白雪 巴/にじさんじ】",
      54,
      1766598668,
      16561,
      [
        78,
        457,
        458,
        465,
        589,
        54
      ]
    ],
    [
      "ewtbVStzFUc",
      "マクドナルド新作バーガー「トロ旨タルタル&デミグラコロ」を食べてみる🍔💜【白雪 巴/にじさんじ】",
      54,
      1766398609,
      4102,
      [
        82,
        589,
        54
      ]
    ],
    [
      "6Tpm2FN6iBw",
      "#にぎにじダンス オオカミになって踊ってみた🐺💜#shorts #白雪巴 #にじさんじ",
      54,
      1766228413,
      41,
      [
        81,
        564,
        588,
        54
      ]
    ],
    [
      "37R4N3H1Ji4",